{
  "formatVersion": 1,
  "id": "20261001-m3-ui-application-boundary-implementation-set",
  "members": [
    {
      "order": 1,
      "planId": "20261001-m3-pr-documentation-root",
      "path": "docs/plans/20261001-m3-pr-documentation-root.plan.json",
      "sha256": "c63873d8ab0d3c7af710741d3ef14a8a75ae4b23d557bbfba50a97198ba6e9ad",
      "dependsOn": []
    },
    {
      "order": 2,
      "planId": "20261001-m3-pr-implementation-root",
      "path": "docs/plans/20261001-m3-pr-implementation-root.plan.json",
      "sha256": "dc19d53731d8d71f7e14b7ae8793e9749cf765db370270ee1c461bbc3f9f890c",
      "dependsOn": [
        "20261001-m3-pr-documentation-root"
      ]
    }
  ],
  "derivedUnion": {
    "plannedPaths": [
      "core/application/contracts/application-preview.schema.json",
      "core/application/contracts/application-service-contract.json",
      "core/application/contracts/application-service-contract.schema.json",
      "core/application/contracts/authority-handoff.schema.json",
      "core/application/contracts/lifecycle-preview.schema.json",
      "core/application/contracts/protection-status.schema.json",
      "core/application/contracts/setup-preview.schema.json",
      "core/application/validation/Test-V4ApplicationBoundary.ps1",
      "core/host/V4.Guards.Host/ApplicationRuntime.cs",
      "core/host/V4.Guards.Host/ProfileRuntime.cs",
      "core/host/V4.Guards.Host/Program.cs",
      "core/host/V4.Guards.Host/QueryRuntime.cs",
      "docs/application-workbench.md",
      "docs/plans/20261001-m3-application-service-boundary.md",
      "docs/plans/20261001-m3-application-service-boundary.plan.json",
      "docs/plans/20261001-m3-authority-lifecycle-handoffs.md",
      "docs/plans/20261001-m3-authority-lifecycle-handoffs.plan.json",
      "docs/plans/20261001-m3-companion-workbench.md",
      "docs/plans/20261001-m3-companion-workbench.plan.json",
      "docs/plans/20261001-m3-implementation-program.md",
      "docs/plans/20261001-m3-implementation-program.plan.json",
      "docs/plans/20261001-m3-pr-documentation-root.md",
      "docs/plans/20261001-m3-pr-documentation-root.plan.json",
      "docs/plans/20261001-m3-pr-implementation-root.md",
      "docs/plans/20261001-m3-pr-implementation-root.plan.json",
      "docs/plans/20261001-m3-setup-protection-preview.md",
      "docs/plans/20261001-m3-setup-protection-preview.plan.json",
      "docs/plans/20261001-m3-ui-application-boundary-implementation.plan-set.json",
      "docs/plans/product/TODO.md",
      "integrations/web/V4.Guards.WebCompanion/Program.cs",
      "integrations/web/V4.Guards.WebCompanion/contracts/application-confirm-request.schema.json",
      "integrations/web/V4.Guards.WebCompanion/contracts/application-operation-request.schema.json",
      "integrations/web/V4.Guards.WebCompanion/contracts/application-operation-response.schema.json",
      "integrations/web/V4.Guards.WebCompanion/contracts/application-receipt.schema.json",
      "integrations/web/V4.Guards.WebCompanion/contracts/session.schema.json",
      "integrations/web/V4.Guards.WebCompanion/wwwroot/app.js",
      "integrations/web/V4.Guards.WebCompanion/wwwroot/index.html",
      "integrations/web/V4.Guards.WebCompanion/wwwroot/styles.css"
    ],
    "areas": [
      "GuardDocs",
      "application",
      "contracts",
      "host",
      "tests",
      "web"
    ],
    "risks": [
      "A lifecycle preview could be mistaken for authorization to mutate Target or remote state.",
      "A local preview or receipt could be mistaken for completed Target or remote authority.",
      "A loopback caller could attempt cross-origin or oversized requests against the Companion.",
      "A stale preview could be confirmed after its Package or Target inputs change.",
      "Empty or partial evidence could be presented as protected."
    ],
    "decisions": [
      "Bind previews to catalogued schemas exact Package Target State Evidence and Plan identities and the current preview hash.",
      "Expose only lifecycle verification while compose select rollback retention and remote activation remain unavailable.",
      "Keep Target writes composition selection CI activation and remote lifecycle actions outside M3 authority.",
      "Keep the M3 application command surface experimental and separate from the frozen stable CLI contract.",
      "Require session exact loopback origin independent CSRF request limits serialization and cancellation in the Companion."
    ],
    "validationCommands": [
      "Test-Json for all M3 Plan JSON files",
      "exact plan-set diff",
      "pwsh -NoProfile -File core/application/validation/Test-V4ApplicationBoundary.ps1",
      "pwsh -NoProfile -File tests/p0/Test-V4Contracts.ps1",
      "pwsh -NoProfile -File tests/p1/Test-V4Package.ps1",
      "pwsh -NoProfile -File tests/p10/Test-V4ExtensionComposition.ps1",
      "pwsh -NoProfile -File tests/p7/Test-V4Documentation.ps1",
      "pwsh -NoProfile -File tests/p8/Test-V4CompatibilityBaseline.ps1",
      "pwsh -NoProfile -File tests/p8/Test-V4StableCli.ps1",
      "pwsh -NoProfile -File tests/p9/Test-V4EvidencePlanCenter.ps1",
      "pwsh -NoProfile -File tests/p9/Test-V4OfflineWebDistribution.ps1",
      "pwsh -NoProfile -File tests/p9/Test-V4WebCompanionSpike.ps1",
      "pwsh -NoProfile -File tests/p9/Test-V4WorkspaceStageRunner.ps1"
    ],
    "boundaries": []
  },
  "compositionHash": "00472dd0494fdf9e7eb223f09f8e82f21e9a3c51153673568dc2a7097508e04d"
}
